{
  "$schema": "https://json-schema.org/draft/2020-12/schema",
  "$id": "https://yukh.example/schemas/capability/v1/plan.schema.json",
  "type": "object",
  "additionalProperties": false,
  "required": [
    "plan_version", "plan_id", "plan_digest", "request_id", "capability",
    "subject_ref", "resource_ref", "environment", "policy_decision_ref",
    "created_at", "expires_at", "preconditions", "effects", "verification", "rollback"
  ],
  "properties": {
    "plan_version": { "const": 1 },
    "plan_id": { "$ref": "https://yukh.example/schemas/capability/v1/common.schema.json#/$defs/opaqueId" },
    "plan_digest": { "$ref": "https://yukh.example/schemas/capability/v1/common.schema.json#/$defs/digest" },
    "request_id": { "$ref": "https://yukh.example/schemas/capability/v1/common.schema.json#/$defs/opaqueId" },
    "capability": { "$ref": "https://yukh.example/schemas/capability/v1/common.schema.json#/$defs/capabilityRef" },
    "subject_ref": { "$ref": "https://yukh.example/schemas/capability/v1/common.schema.json#/$defs/opaqueId" },
    "resource_ref": {
      "oneOf": [
        { "$ref": "https://yukh.example/schemas/capability/v1/common.schema.json#/$defs/resourceRef" },
        {
          "type": "array", "minItems": 1, "maxItems": 1000, "uniqueItems": true,
          "items": { "$ref": "https://yukh.example/schemas/capability/v1/common.schema.json#/$defs/resourceRef" }
        }
      ]
    },
    "environment": { "$ref": "https://yukh.example/schemas/capability/v1/common.schema.json#/$defs/environment" },
    "policy_decision_ref": { "$ref": "https://yukh.example/schemas/capability/v1/common.schema.json#/$defs/opaqueId" },
    "created_at": { "$ref": "https://yukh.example/schemas/capability/v1/common.schema.json#/$defs/timestamp" },
    "expires_at": { "$ref": "https://yukh.example/schemas/capability/v1/common.schema.json#/$defs/timestamp" },
    "preconditions": { "type": "array", "maxItems": 64, "items": { "type": "object", "maxProperties": 16 } },
    "effects": { "type": "array", "maxItems": 64, "items": { "type": "object", "maxProperties": 16 } },
    "verification": { "type": "array", "maxItems": 64, "items": { "type": "object", "maxProperties": 16 } },
    "rollback": { "enum": ["not_applicable", "compensating", "restore", "unavailable"] }
  }
}
