{
  "plan_version": 1,
  "plan_id": "plan_example91c2",
  "plan_digest": "sha256:0000000000000000000000000000000000000000000000000000000000000000",
  "request_id": "req_example8d4b",
  "capability": { "id": "example.setting.update", "version": "1.0.0" },
  "subject_ref": "sub_example001",
  "resource_ref": "setting-example-01",
  "environment": "development",
  "policy_decision_ref": "decision_example001",
  "created_at": "2026-08-03T00:00:00Z",
  "expires_at": "2026-08-03T00:05:00Z",
  "preconditions": [{ "kind": "version_equals", "value": 7 }],
  "effects": [{ "kind": "update", "field": "display_mode" }],
  "verification": [{ "kind": "setting_value_matches" }],
  "rollback": "restore"
}
